{
  "message": {
    "body": "Hey! Join POAP KINGS — a 18-member Clash Royale clan with active play, good vibes, and POAPs as proof. https://poapkings.com"
  },
  "social": {
    "body": "👑 POAP KINGS — 18 members, 132,730+ combined trophies. Active play, good vibes, POAPs as proof. https://poapkings.com"
  },
  "email": {
    "subject": "POAP KINGS | A Clash Royale Clan With Proof",
    "body": "Hi there,\n\nWe wanted to share an invitation to join a great Clash Royale clan: POAP KINGS.\n\nPOAP KINGS is built around active, positive gameplay and something a little different—collecting POAPs as proof of participation and shared clan history. With 18 members and 132,730 combined trophies, it's a growing community for players who enjoy progression, competition, and being part of something.\n\nPOAP KINGS | A Clan With Proof\nClan Tag: #J2RGCRVG\nRegion: United States\nLeague: Bronze (and climbing)\nMembers: 18\nCombined Trophies: 132,730\nWeekly Donations: 212\nAvg Member Level: 42.5\nRequired Trophies: 2,000\n\nWhat makes POAP KINGS different\n- Clan members collect unique POAPs tied to milestones and participation\n- War winners are awarded Free Pass Royale\n- Elders donate regularly to support the clan\n- War participation is encouraged, but not required\n- Active members expected; inactive accounts are removed to keep the clan healthy\n\nEarly active members will receive a POAP KINGS Founder token, marking them as part of the clan from the start.\n\nIf this sounds like a good fit, here's how to learn more or join:\n\n🌎 Learn more: https://poapkings.com\n🔗 Join the clan: https://link.clashroyale.com/invite/clan/en?tag=J2RGCRVG&token=dtw94pzg\n\nHope to see you in the arena."
  },
  "discord": {
    "body": "👑 POAP KINGS | A CLAN WITH PROOF\n🏷️ Clan Tag: #J2RGCRVG\n🇺🇸 Region: United States\n↕️ League: Bronze (and climbing)\n👥 Members: 18\n🏆 Combined Trophies: 132,730\n🤝 Weekly Donations: 212\n⬆️ Avg Member Level: 42.5\n🔑 Required Trophies: [2000]\n\n🌟 Clan members collect unique POAPs\n🥇 War winner awarded Free Pass Royale!\n🔥 War participation encouraged but not required\n⛔️ Active members expected, idle members will be removed\n\n🌎 Learn more: https://poapkings.com\n🔗 Clan Invite: https://link.clashroyale.com/invite/clan/en?tag=J2RGCRVG&token=dtw94pzg"
  },
  "reddit": {
    "title": "POAP KINGS: A CLAN WITH PROOF #J2RGCRVG [2000] — 18 members",
    "body": "👑 POAP KINGS | A CLAN WITH PROOF\n🏷️ Clan Tag: #J2RGCRVG\n🇺🇸 Region: United States\n↕️ League: Bronze (and climbing)\n👥 Members: 18\n🏆 Combined Trophies: 132,730\n🤝 Weekly Donations: 212\n⬆️ Avg Member Level: 42.5\n🔑 Required Trophies: [2000]\n\n🌟 Clan members collect unique POAPs\n🥇 War winner awarded Free Pass Royale!\n🔥 War participation encouraged but not required\n⛔️ Active members expected, idle members will be removed\n\n🌎 Learn more: https://poapkings.com"
  }
}
