{
  "message": {
    "body": "POAP KINGS (#J2RGCRVG) is recruiting \u2014 5,000 trophies required, war-focused clan with 18 players at 12k+ trophies and a Free Pass Royale program. Check us out at https://poapkings.com"
  },
  "social": {
    "body": "POAP KINGS is looking for serious Clash Royale players. We're a 43-member war clan with 18 players at 12k+ trophies, 4 sitting at 14,000, and 154K+ career wins across the roster. We track milestones, run a Free Pass Royale program, and actually remember who shows up. 5,000 trophies to join. https://poapkings.com"
  },
  "email": {
    "subject": "POAP KINGS is recruiting \u2014 war-focused clan, 5,000 trophy minimum",
    "body": "POAP KINGS is a Clash Royale clan built around Clan Wars, real recognition, and a culture that most clans never bother to create.\n\nWe have 43 members, 18 players at 12,000+ trophies, 4 sitting at 14,000, and more than 154,000 career wins across the roster. Our recorded river race history shows consistent first-place weeks. We track all of it.\n\nWhat makes us different: we issue POAPs for seasons and milestones, run a Free Pass Royale program for top war performers, and publish the clan data so serious players can see the depth of the roster.\n\nWe want players who show up for war, donate to clanmates, and want to be part of something intentional. Real life comes first, but when you're in, we notice.\n\nMinimum 5,000 trophies. Come see what we're building at https://poapkings.com"
  },
  "discord": {
    "body": "**POAP KINGS (#J2RGCRVG) is recruiting \u2014 Required Trophies: [5000]**\n\nWe're a war-focused Clash Royale clan with 43 members, real structure, and culture that most clans skip entirely.\n\n**Why we're different:**\n- 18 players at 12,000+ trophies, with 4 sitting at 14,000\n- 154K+ career wins across the roster\n- We issue POAPs for seasons and milestones (yes, actual collectible proof of attendance)\n- Free Pass Royale program for top war performers each season\n- Public roster and Clan Wars data so serious players can see who they're joining\n\n**What we want:**\n- Players who show up for Clan Wars\n- Consistent donators\n- People who want to build something, not just fill a slot\n\nReal life comes first. But when you're here, we notice what you do.\n\nhttps://poapkings.com"
  },
  "reddit": {
    "title": "POAP KINGS #J2RGCRVG | War-focused clan with real culture | [5000] trophies required | 43/50 members",
    "body": "**POAP KINGS \u2014 #J2RGCRVG**\n\n**Quick stats:**\n- 43 members, 5,000 trophy minimum\n- 18 players at 12,000+ trophies\n- 4 members at 14,000 trophies\n- 154K+ career wins across the roster\n- Clan war trophies: 680 and climbing\n\n**Who we are:**\n\nPOAP KINGS is a war-focused clan that also cares about building something with staying power. We track stats, recognize effort, and create actual clan memory \u2014 not just a Discord server with a trophy requirement.\n\nWe run a **Free Pass Royale program** for top war performers each season. We issue **POAPs** (collectible proof-of-attendance tokens) for seasons and milestones. We publish roster and Clan Wars data so people can see the depth of the clan before joining.\n\nOur top players \u2014 OllieTurtle, Vijay, and Aaqib Javed \u2014 are all at 14,000 trophies. Our roster includes long-time accounts, deep collections, and active war players.\n\n**What we're looking for:**\n- Players who participate in Clan Wars when they can\n- Consistent donators who support clanmates\n- People who want to be part of a clan with identity, not just a leaderboard slot\n\nReal life always comes first. But if you're going to play, we'd rather you play with people who notice.\n\nFind us at https://poapkings.com or search the tag in-game."
  }
}
