{
  "message": {
    "body": "POAP KINGS (#J2RGCRVG) recruiting — Required 2000+ trophies. 37 members, 233,576 combined trophies, 2,164 weekly donations. War-focused + we do POAPs + Free Pass Royale for our War Champ. Info: https://poapkings.com"
  },
  "social": {
    "body": "POAP KINGS (#J2RGCRVG) is recruiting (2000+ trophies).\n\n37 members • 233,576 combined trophies • 2,164 weekly donations • 180 Clan War trophies • avg lvl 38.2\n\nLeaders: raquaza (Log + Goblin Barrel), King Levy (Log + Giant Snowball), King Thing (Cannon + Witch).\nWe run Clan Wars seriously, track milestones with Elixir, and we do POAPs + a Free Pass Royale reward for our season War Champ.\nhttps://poapkings.com"
  },
  "email": {
    "subject": "POAP KINGS (#J2RGCRVG): war-focused clan with POAPs + Free Pass Royale (2000+ trophies)",
    "body": "Hey — recruiting for POAP KINGS (#J2RGCRVG).\n\nIf you want a clan that actually tracks effort, celebrates milestones, and still plays to win, that’s us.\n\nQuick snapshot (durable stats):\n- Members: 37\n- Required trophies: 2,000+\n- Combined trophies: 233,576\n- Weekly donations: 2,164\n- Clan War trophies: 180\n- Avg member level: 38.2\n\nWhat makes POAP KINGS different:\n- We’re war-minded, but low-drama. Real life comes first, but when you can play wars, we care about consistency.\n- POAP culture is real here (Proof of Attendance / “Proof of Arena Push”). We like building a collectible record of seasons + clan moments.\n- We run a Free Pass Royale reward for our War Champ each season (top war contributor). It’s meant to be earned, not handed out.\n- We even have Elixir (our clan ops/record-keeper) helping us track wars, milestones, and shout-outs so effort doesn’t get forgotten.\n\nStandouts you’ll see in-chat:\n- raquaza (Co-Leader) — war driver; signature: The Log + Goblin Barrel; 12,277 trophies; 214 donations; 5,550 season fame.\n- King Levy (Co-Leader) — steady war energy; signature: The Log + Giant Snowball; 11,532 trophies; 235 donations.\n- King Thing (Leader) — builder/organizer; signature: Cannon + Witch; 10,328 trophies; 239 donations.\n- Chanco (Elder) — donation engine; signature: Inferno Dragon + Witch; 250 donations.\n- Vijay (Elder) — ladder power; signature: The Log + Goblin Barrel; 12,000 trophies; 4,950 season fame.\n\nWhat we’re looking for:\n- 2,000+ trophies\n- Active players who donate and show up for Clan Wars when they can\n- People who like a clan with structure, recognition, and momentum\n\nIf that sounds like your kind of home, take a look and hop in:\nhttps://poapkings.com\n\n— POAP KINGS recruiting"
  },
  "discord": {
    "body": "**POAP KINGS (#J2RGCRVG) — war-focused clan with POAPs + Free Pass Royale. Required Trophies: [2000]**\n\nWe’re building something intentional: a competitive Clan Wars core with real tracking + recognition (not a silent clan list).\n\n**Snapshot**\n- 37 members\n- 233,576 combined trophies\n- 2,164 weekly donations\n- 180 Clan War trophies\n- Avg member level: 38.2\n\n**Leaders + player identity (real people, real decks):**\n- raquaza (Co-Leader) — The Log + Goblin Barrel; 12,277 trophies; 5,550 season fame\n- King Levy (Co-Leader) — The Log + Giant Snowball; 11,532 trophies; big on war consistency\n- King Thing (Leader) — Cannon + Witch (plus Royal Ghost); runs the builder side of the clan\n- Chanco (Elder) — Inferno Dragon + Witch; donation leader (250)\n- Vijay (Elder) — Log + Goblin Barrel; 12,000 trophies; 4,950 season fame\n\n**What makes us different**\n- POAPs for meaningful clan moments (Proof of Attendance / Proof of Arena Push)\n- Free Pass Royale reward for the season War Champ\n- We track wars + milestones with Elixir so effort doesn’t disappear\n\nIf you’re 2000+ and want a clan that actually moves together: https://poapkings.com"
  },
  "reddit": {
    "title": "[2000] POAP KINGS (#J2RGCRVG) | War-focused + POAP culture | 37 members | 233,576 trophies | 2,164 weekly donations",
    "body": "POAP KINGS (#J2RGCRVG) recruiting. Required trophies: 2,000+\n\n**Clan snapshot**\n- Members: 37\n- Combined trophies: 233,576\n- Weekly donations: 2,164\n- Clan War trophies: 180\n- Avg member level: 38.2\n\n**Who we are**\nWe’re a war-minded, builder-style clan: organized, low-drama, and serious about momentum. We also do POAPs (Proof of Attendance / “Proof of Arena Push”) to make clan history feel real, and we award a Free Pass Royale to our season War Champ (top war contributor).\n\n**Standouts (with signature cards / style)**\n- raquaza (Co-Leader) — The Log + Goblin Barrel; 12,277 trophies; 214 donations; 5,550 season fame\n- King Levy (Co-Leader) — The Log + Giant Snowball; 11,532 trophies; 235 donations\n- King Thing (Leader) — Cannon + Witch (often Royal Ghost too); 10,328 trophies; 239 donations\n- Chanco (Elder) — Inferno Dragon + Witch; 11,137 trophies; 250 donations\n- Vijay (Elder) — The Log + Goblin Barrel; 12,000 trophies; 4,950 season fame\n\n**What we want**\n- Active players who donate and contribute to Clan Wars when they can\n- People who like a clan with structure, recognition, and long-term continuity\n\nLearn more at https://poapkings.com (no invite link here per subreddit rules)."
  }
}
